MCQ,Choices,Correct
What is machine learning?,a: A field of study in artificial intelligence concerned with the development and study of statistical algorithms | b: A field of study in robotics concerned with building physical machines | c: A field of study in biology concerned with animal behavior | d: A field of study in chemistry concerned with chemical reactions,a
Who coined the term 'machine learning'?,a: Alan Turing | b: Donald Hebb | c: Arthur Samuel | d: Tom M. Mitchell,c
What is the main objective of modern-day machine learning?,a: To achieve artificial intelligence | b: To tackle practical problems | c: To focus on symbolic approaches | d: To ignore statistics,b
What is the relationship between machine learning and AI?,a: Machine learning is a separate field from AI | b: Machine learning grew out of the quest for AI | c: AI is not related to machine learning | d: Machine learning is a subset of AI,b
What is the purpose of data compression in machine learning?,a: To increase the size of data files | b: To slow down data transmission | c: To reduce the size of data files | d: To complicate storage efficiency,c
